Date,Platform,Time_EST,Content_Type,Caption_Summary,Full_Caption_Source,Hashtag_Pack,Destination_Link,Image_File,Posting_Notes
2026-06-26,TikTok,06:00 PM,Educational Video,"Ferment, can, or dry? How I decide what to do with each harvest.","phase-2-social-content-calendar-60day.md > June 26 TT","#foodpreservation #fermentation #canning #drying #homesteading #growyourown #seedwarden #gardeningtok",Harvest Preservation Handbook Etsy listing,marketing/lifestyle-photos/etsy-ready/cluster-c-slot4.jpg,Matches newsletter theme — coordinate timing
2026-06-26,Pinterest,08:00 PM,Product Pin,"Harvest Preservation Handbook — 47 recipes. Fermentation. Canning. Drying. Everything for your harvest.","phase-2-social-content-calendar-60day.md > June 26 Pin","#foodpreservation #harvest #fermentation #canning #homesteading #growyourown #seedwarden",Harvest Preservation Handbook Etsy listing,marketing/lifestyle-photos/etsy-ready/cluster-c-slot4.jpg,End-of-month product pin — keep fresh with updated copy
2026-06-27,Instagram,10:00 AM,Educational - Carousel,"30-day wrap: what grew, what didn't, and what Seedwarden is building next.","phase-2-social-content-calendar-60day.md > June 27 IG","#seedwarden #growyourown #smallbusiness #etsyseller #heirloomseeds",Kit landing page,marketing/lifestyle-photos/etsy-ready/cluster-a-hero.jpg,Momentum post — week 4 close; tease Phase 3 if timeline allows
2026-06-27,Pinterest,08:00 PM,Educational Pin,"Summer garden checklist: 6 things to do in your garden this week.","phase-2-social-content-calendar-60day.md > June 27 Pin","#summergarden #gardeningtips #growyourown #vegetablegarden #seedwarden",Zone Quick-Start Card Etsy listing,assets/zone-cards/zone-5-preview.png,Seasonal relevance — drives traffic during peak gardening season
2026-06-28,Instagram,10:00 AM,CTA - Reel,"If you've been thinking about downloading the zone card — this is the nudge. Link in bio.","phase-2-social-content-calendar-60day.md > June 28 IG","#zonegardening #growyourown #gardeningcalendar #seedwarden #freegarden",Kit landing page,assets/zone-cards/zone-5-preview.png,Final June CTA reel — conversational tone
2026-06-28,TikTok,11:00 AM,CTA Video,"Free zone card — no credit card, no catch. Here's why I made it free.","phase-2-social-content-calendar-60day.md > June 28 TT","#zonegardening #growyourown #seedwarden #gardeningtok #freegarden",Kit landing page,assets/zone-cards/zone-5-preview.png,Explainer-style CTA — works well for TikTok
2026-06-28,Pinterest,08:00 PM,Product Pin,"Zone Quick-Start Card — your zone, your crops, right now. Free. One page.","phase-2-social-content-calendar-60day.md > June 28 Pin","#zonegardening #gardeningcalendar #growyourown #freegarden #seedwarden",Kit landing page,assets/zone-cards/zone-5-preview.png,End-of-month CTA pin — drive sign-ups into July
2026-06-29,Instagram,10:00 AM,Educational - Single Image,"One thing I wish I knew before my first seed saving season. (Save this.)","phase-2-social-content-calendar-60day.md > June 29 IG","#seedsaving #heirloomseeds #growyourown #gardeningtips #foodsovereignty #seedwarden",Seed Saving Field Manual Etsy listing,marketing/lifestyle-photos/etsy-ready/cluster-a-hero.jpg,High-save educational format — tip revealed in slide or caption
2026-06-29,Pinterest,08:00 PM,Educational Pin,"How to build a no-dig garden bed — the method that skips the hard labor.","phase-2-social-content-calendar-60day.md > June 29 Pin","#nodigigarden #gardeningtips #growyourown #raisedbed #organicgardening #seedwarden",Heirloom Guide Etsy listing,marketing/lifestyle-photos/etsy-ready/cluster-a-hero.jpg,High-interest beginner topic — drives saves and follows
2026-06-30,Instagram,10:00 AM,Monthly Wrap - Carousel,"June by the numbers: posts, downloads, orders, and what's coming in July.","phase-2-social-content-calendar-60day.md > June 30 IG","#seedwarden #smallbusiness #growyourown #etsyseller #creatortok",Kit landing page,marketing/lifestyle-photos/etsy-ready/cluster-a-bts.jpg,Monthly wrap — transparency builds audience trust and retention
2026-06-30,TikTok,06:00 PM,Monthly Wrap Video,"June was our first full month of Phase 2. Here's what actually happened.","phase-2-social-content-calendar-60day.md > June 30 TT","#smallbusiness #etsyseller #seedwarden #growyourown #creatortok #digitaldownload",Kit landing page,marketing/lifestyle-photos/etsy-ready/cluster-a-bts.jpg,Data-honest founder content — authentic format works on TikTok
2026-06-30,Pinterest,08:00 PM,Product Pin,"Seed Saving Field Manual — everything you need to save seeds from 30 varieties and grow for food sovereignty.","phase-2-social-content-calendar-60day.md > June 30 Pin","#seedsaving #heirloomseeds #foodsovereignty #growyourown #sustainability #seedwarden",Seed Saving Field Manual Etsy listing,marketing/lifestyle-photos/etsy-ready/cluster-a-hero.jpg,Month-close product pin — strong evergreen

POSTING_NOTES_GLOBAL,,,,,,,,,
INSTAGRAM_OPTIMAL_TIMES,Best engagement windows: 9:00–10:00 AM EST (educational content) and 2:00–3:00 PM EST (CTAs). Avoid posting before 8:00 AM or after 9:00 PM EST.,,,,,,,
TIKTOK_OPTIMAL_TIMES,"Best engagement windows: 11:00 AM–1:00 PM EST and 6:00–8:00 PM EST. Upload natively — do not use Buffer for TikTok video upload if video quality degrades.",,,,,,,
PINTEREST_OPTIMAL_TIMES,Best engagement windows: 8:00–11:00 PM EST (evergreen and educational pins). Product pins perform consistently across all times — optimize for batch scheduling.,,,,,,,
HASHTAG_STRATEGY,"Core pack (use on every post): #seedwarden #growyourown #heirloomseeds. Rotating topical pack: match to content type. Maximum 10 hashtags on Instagram. TikTok: 5–7 hashtags. Pinterest: include hashtags in description body — not as trailing tags.",,,,,,,
CONTENT_BUCKET_BREAKDOWN,"Educational: 40% of posts. Product/CTA: 22%. Social Proof: 12%. Behind the Scenes: 10%. Lifestyle/Seasonal: 16%. Maintain this ratio — heavy product posting suppresses organic reach on IG and TikTok.",,,,,,,
CAROUSEL_SPECS,"Instagram carousel: 1080x1080px per slide. 3–8 slides. First slide must function as a standalone post — assume most viewers only see slide 1.",,,,,,,
VIDEO_SPECS,"TikTok: 9:16 vertical, 1080x1920px. 30–60 seconds optimal. Use text overlay for first 3 seconds to retain viewers past the first swipe.",,,,,,,
PINTEREST_SPECS,"Pinterest standard pin: 1000x1500px (2:3 ratio). Carousel pin: same dimensions per slide. Add text overlay to every pin — Pinterest is a visual search engine; context must be visible without clicking.",,,,,,,
