Date,Day,Task,Owner,Success Criteria,Status
2026-06-01,Day 3,Log morning metrics (Etsy views/orders/revenue + Kit subscribers) in customer-analytics.csv,Solo,Row added to CSV with all 7 daily fields populated,Open
2026-06-01,Day 3,Verify Kit welcome automation is active and firing correctly — Kit > Automations > Seedwarden Welcome must show Published,Solo,Status shows Published; test subscriber receives Email 1 within 60 seconds of form submit,Open
2026-06-01,Day 3,Confirm all 21 Etsy listings Active — check Shop Manager for any Draft or Under Review status,Solo,All 21 listings green Active status; zero in Draft,Open
2026-06-01,Day 3,Audit top 3 listing titles — primary keyword phrase must lead the title (not product name),Solo,Top 3 listings by launch-week views have search phrase in position 1 of title,Open
2026-06-02,Day 4,TikTok + Reel: Zone Card Reveal — film and post or schedule. "I built free planting calendars for Zones 3–10. Here's what's in Zone 5.",Solo,Video posted natively; 50+ views within 24 hours,Open
2026-06-02,Day 4,Log WORKLOG.md entry: any orders or anomalies from Days 1–4 post-launch,Solo,WORKLOG entry added with Etsy/Kit/social snapshot,Open
2026-06-03,Day 5,TikTok: Stellaria (chickweed) wild edibles identification video. Habit photo as B-roll. "Growing in your yard right now — and it's edible.",Solo,Video posted; caption includes #wildedibles #foraging hashtags,Open
2026-06-04,Day 6,Pinterest batch session — 18 pins produced and scheduled: 8 zone card pins (one per zone) + 5 product lifestyle pins + 5 wild edibles botanical pins,Solo,18 pins scheduled in Tailwind or Pinterest scheduler; all destination URLs verified,Open
2026-06-04,Day 6,Instagram Carousel: Zone Quick-Start Card 6-slide walkthrough posted — frost dates / crops / storage / varieties / free at bio link,Solo,Carousel posted; caption ends with "Which zone are you in?" engagement prompt,Open
2026-06-05,Day 7,TikTok + Reel: Seed Starting Station setup — "Your setup doesn't need to cost $200." Film Monday batch.,Solo,Video posted; completion rate above 30% within 48 hours (check TikTok Analytics),Open
2026-06-05,Day 7,Send Broadcast 1 email to full Kit list: "Your first week with the zone card — what to do right now." Schedule for 7am Thursday June 5,Solo,Broadcast status shows Sent or Sending by 7:15am; open rate above 35% at 48-hour mark,Open
2026-06-05,Day 7,Reddit: r/vegetablegardening — answer 2 zone-appropriate seed starting timing questions. No product pitching.,Solo,2 answers posted with genuine content; upvotes or follow-up replies within 72 hours,Open
2026-06-06,Day 8,Week 1 full review (block 30 min): pull Etsy views/orders/conversion rate, Kit subscriber count, email open rates. Log in WORKLOG.md.,Solo,"Review completed; decision logged on 3 items: which products to feature in Week 2, email angle, hold or accelerate",Open
2026-06-07,Day 9,Etsy tag refresh: for any listing with 100+ views and zero orders — replace 2–3 underperforming tags with long-tail alternatives,Solo,Tags updated on at least 1 underperforming listing; no more than 3 tags changed per listing at once,Open
2026-06-09,Day 11,TikTok + Reel: "Tomatoes in a 5-gallon bucket — the 3 things most guides skip." Container growing Week 2 theme launch.,Solo,Video posted; caption includes Zone Quick-Start Card bio link mention,Open
2026-06-10,Day 12,TikTok: Taraxacum (dandelion) wild edibles video — "Every part of the dandelion is edible. Here's the breakdown.",Solo,Video posted natively; 50+ views within 24 hours,Open
2026-06-11,Day 13,TikTok + Reel: Balcony garden planning — "6 hours of sun and 40 square feet." Zone-specific layout walkthrough.,Solo,Video posted; Instagram Reel repurposed version also scheduled,Open
2026-06-11,Day 13,Instagram Carousel: "Container sizes vs. what you can actually grow in them." 7-slide educational chart. End slide: "Full container guide in bio.",Solo,Carousel posted; tracks saves-to-reach ratio — target 5% saves,Open
2026-06-12,Day 14,TikTok: Product spotlight — Container Growing Blueprint Pack. Open the guide on camera. Flip through sizing chart. 30 seconds. Bio link.,Solo,Video posted; no commercial language in caption (avoids algorithm suppression),Open
2026-06-12,Day 14,Instagram Stories poll: "Do you have outdoor growing space?" Four options. Run for 24 hours. Log results in WORKLOG.md after expiry.,Solo,Poll published; results logged — note distribution across 4 options for future content weighting,Open
2026-06-13,Day 15,Week 2 Sunday review (15 min): Email 3 should have arrived for subscribers who joined Day 8 or earlier. Check Email 3 open rate — target 40%+. Alert if below 25%.,Solo,Email 3 open rate logged; if below 25% investigate subject line and sender authentication,Open
2026-06-14,Day 16,Identify top 3 Kit subscribers by link clicks in Emails 3–4. Send personal DM requesting photo of guide in use for 20% next-purchase discount.,Solo,3 personal DMs sent via Kit or email; log names and send dates,Open
2026-06-15,Day 17,TikTok + Reel: Preservation season preview — "Your harvest is 3 weeks away. Here's what to have ready now." Mason jars / lids / salt / canning pot supply list.,Solo,Video posted; includes #foodpreservation #homesteading hashtags,Open
2026-06-17,Day 19,Pinterest batch session: 15 pins for Food Preservation Season board. "Lacto-ferment cucumbers" / "canning basics" / "hot sauce fermentation." Link to Fermented and Preserved Harvest Handbook.,Solo,15 pins scheduled; all descriptions optimized for Google-readable phrases (not hashtag-style),Open
2026-06-18,Day 20,TikTok + Reel: Lacto-fermented pickles demo — "15 minutes prep, 5 days in a jar. No canning equipment.",Solo,Video posted; process demonstration is complete (not just teased) — no clickbait finish,Open
2026-06-18,Day 20,Instagram Carousel: "5 things to do with your first summer harvest before you're overwhelmed." Blanch+freeze / pickle / dry herbs / ferment / freeze sauce. Save-optimized caption.,Solo,Carousel posted; caption ends with preservation-season urgency framing,Open
2026-06-19,Day 21,Send Broadcast 4 — Community Engagement: "What's growing this week?" Open-loop email — no product CTA. Just "Hit reply and tell me one thing.",Solo,Broadcast sent; reply rate logged over 72 hours; all replies responded to within 24 hours,Open
2026-06-20,Day 22,Week 3 Sunday review (15 min): Check Etsy conversion rate running total — should be 1.0%+ by Week 3. Check Kit subscriber total — should be 30+ by this date. Log in WORKLOG.md.,Solo,Weekly review logged; conversion rate assessed; any underperforming listings flagged for Week 4 fixes,Open
2026-06-21,Day 23,Reddit: r/homesteading and r/Canning — answer 2 preservation method questions. r/preppers — 1 shelf-stable production question. No product pitches.,Solo,3 answers posted; genuine expertise demonstrated; no selling language,Open
2026-06-23,Day 25,TikTok + Reel: USDA zone overview — "Which zone are you?" Educational backbone for new followers. This re-introduces zone card for anyone who missed Week 1.,Solo,Video posted; 100+ views within 48 hours; CTA is bio link for free zone card,Open
2026-06-24,Day 26,Pinterest batch: All-8-zones final push. One pin per zone (8 pins) — "Free Zone [X] Planting Calendar for [Region] growers." Plus 7 supplementary pins from strongest-performing pin format in June.,Solo,15+ pins scheduled; all 8 zone card pins confirmed with correct Kit landing page URLs,Open
2026-06-25,Day 27,Send Broadcast 5 — Upsell: "If you've been thinking about it — here's a reason to move this week." SEEDWARDEN15 coupon. Feature top 2 products by June Etsy views. Segmented by behavioral tag if list is 50+.,Solo,Broadcast sent; click rate target 5–10%; coupon redemptions logged over 5-day window,Open
2026-06-25,Day 27,TikTok: Elderberry wild edibles identification — "and the lookalike that will make you very sick." High-engagement format.,Solo,Video posted natively; comment-based engagement tracked over 48 hours,Open
2026-06-26,Day 28,Instagram Carousel: "All 8 zones — one graphic." Last frost dates for all zones side-by-side. End: "Get your zone's free card. Link in bio." High share-value post.,Solo,Carousel posted; caption designed for saves and shares (not just likes),Open
2026-06-27,Day 29,TikTok: Phase 3 product tease — "I'm building something for preservation season that launches next month. Brief preview." Generates anticipation comments.,Solo,Video posted; replies noting interest or asking "when?" logged as demand signal,Open
2026-06-28,Day 30 prep,Week 4 review (20 min): Review all June metrics trendlines. Confirm June 29 decision data is ready. Pull Etsy export + Kit subscriber count + repeat buyer check.,Solo,"All data exported: Etsy orders/revenue/conversion, Kit subscribers, social follower counts, repeat buyer count",Open
2026-06-29,Day 30 DECISION,Phase 2 → Phase 3 Decision Review (45 min). Classify: Option A / B / C / D per phase-3-decision-framework.md. Document decision in WORKLOG.md.,Solo,"Decision documented with: June total orders, revenue, blended conversion rate, Kit subscribers, repeat buyers, dominant cohort, Phase 3 option selected, Phase 3 start date",Open
2026-06-29,Day 30 DECISION,Send loyalty email to all June buyers: "Thank you — 20% off anything else in the shop this week. Use code JUNE20." Subject: "Thank you — something for you.",Solo,"Loyalty email sent; responses and JUNE20 redemptions logged over 5 days; note any buyer who makes a second purchase — this is the repeat-purchase signal",Open
2026-06-30,Day 31,Full June feedback audit (30 min): pull all Etsy review text / Kit email replies / survey data. Document top 3 themes in WORKLOG.md. Flag any listing copy improvements for July.,Solo,"Feedback audit logged in WORKLOG.md with: (1) what buyers value most, (2) what they wish was different, (3) 2–3 recurring unanswered questions from listings",Open
