Row,Period,Phase,Track,Task,Start Date,End Date,Duration Days,Dependencies,Float Days,Critical Path,Resource Hours,Status,Notes
1,PRE-SPRINT,Pre-Sprint Decision,Decision,[DECISION GATE] Sprint scope: Option A (5 bundles / single writer) / Option B (5 bundles / 2 writers) / Option C (3-bundle priority — recommended),2026-05-21,2026-05-30,10,Phase 2 metrics confirmed,0,YES,1,PENDING,Must be resolved by May 30 before Phase 2 Track B launches. Blocks all downstream resource allocation. Option C recommended.
2,PRE-SPRINT,Pre-Sprint Decision,Decision,[DECISION GATE] Goldenseal path: order live specimen by June 8 OR confirm Wikimedia CC + botanical garden outreach (Path 2 recommended under Option C),2026-05-21,2026-05-30,10,Scope decision,0,YES,0.5,PENDING,Path 2 (Wikimedia CC): zero cost / zero schedule risk. If Path 1: must order by June 8 hard deadline. Under Option C Immunity launches July 20 — Path 2 is launch quality.
3,PRE-SPRINT,Pre-Sprint Decision,Design,[DECISION GATE] Palette finalization: confirm 6 Phase 3 hex codes by June 15 or default to production-ready codes,2026-05-21,2026-06-15,26,Scope decision,16,NO,0.5,PENDING,Default hex codes: Burgundy #8B3E3E / Sage #6B8E6F / Gold #D4AF37 / Cream #F9F5F0 / Lavender #9B8BA0 / Charcoal #2C2C2C. Revision after June 23 = 1.2 hrs rework per cover.
4,PRE-SPRINT,Pre-Sprint Admin,Admin,[PEER REVIEW BLOCKER] AHG directory outreach — 5-8 RH practitioners (Women's Health specialty filter) for peer review of Black Cohosh and Vitex sections,2026-06-08,2026-06-08,1,Scope decision confirmed,13,NO,1,PENDING,Response cycle 2-3 weeks. Must have written confirmation by June 21. Revenue ceiling risk if missed — practitioner-tier cold outreach will not convert without named reviewer on listing.
5,PRE-SPRINT,Pre-Sprint Photography,Photography,Props acquisition: kraft paper / mortar-pestle / glass jars / linen / wooden tray / white reflector 18x24 in,2026-06-03,2026-06-09,7,Budget confirmed ($60-100),12,NO,2,PENDING,14-day float. Budget $60-100. Can compress to 1 order day by June 8 without sprint impact.
6,PRE-SPRINT,Pre-Sprint Photography,Photography,Seedling photography: Calendula / Red Clover / Lemon Balm / Thyme / Lavender starts (seeds sown by May 26),2026-06-03,2026-06-09,7,Props acquired; seeds started,10,NO,4,PENDING,Annual seeds germinate in 2-4 weeks. 10-day float. Target 30-40 images; cull to 20-30 keepers.
7,PRE-SPRINT,Pre-Sprint Supplier,Supplier,[HARD DEADLINE] Goldenseal order OR Wikimedia CC path confirmed in WORKLOG.md — zero-float June 8 deadline,2026-06-08,2026-06-08,1,Goldenseal decision,0,YES,0.5,PENDING,Zero-float deadline. Prairie Moon rhizome $15-22 / Strictly Medicinal Seeds $12-18. If Path 2: email media@ncbg.unc.edu and media@mobot.org. Log in WORKLOG.md.
8,PRE-SPRINT,Pre-Sprint Supplier,Supplier,Black Cohosh order: Strictly Medicinal Seeds 2-year seedling — optimal order date May 25 for June 21-28 arrival within sprint Week 1,2026-05-25,2026-05-25,1,Scope confirmed,27,NO,0.5,PENDING,If ordered May 25: arrives June 21-28 within sprint. If ordered June 8 (latest): arrives July 13-20. iNaturalist CC-BY Appalachian range is automatic photo fallback.
9,PRE-SPRINT,Pre-Sprint Photography,Photography,Mature/flowering specimen photography: Black Cohosh + arriving Tier 1 plants (shoot within 3 days of arrival),2026-06-10,2026-06-16,7,Tier 1 plants arrived,5,NO,5,PENDING,5-day float. Most Tier 1 specimens arrive July 13-20 — CC fallback ready for sprint. iNaturalist CC-BY is automatic fallback for any species not yet arrived.
10,PRE-SPRINT,Pre-Sprint Supplier,Supplier,[HARD DEADLINE] Elderberry order placed: Prairie Moon bare-root $15-25 or local nursery potted backup,2026-06-15,2026-06-15,1,Goldenseal order complete,0,YES,0.5,PENDING,Zero-float deadline. Local nursery potted elderberry valid contingency (2-week lead; order by June 22 if Prairie Moon OOS). Expected arrival July 13-20.
11,PRE-SPRINT,Pre-Sprint Supplier,Supplier,Mountain Rose Herbs dried herbs ordered: all 13 species 1 oz each ($93-141); request Goldenseal cultivated Certificate of Analysis,2026-06-15,2026-06-15,1,Budget confirmed,5,NO,0.5,PENDING,Frontier Co-op emergency backup (3-5 business day ship). Must arrive by June 17 for studio session. Enables dried herb studio session June 17-21.
12,PRE-SPRINT,Pre-Sprint Design,Design,[PALETTE DECISION DEADLINE] Confirm or approve 6 hex codes for Phase 3 Medicinal palette — auto-lock if no decision,2026-06-15,2026-06-15,1,Palette decision,6,NO,0.25,PENDING,6-day float before June 21 brand kit load. If undecided: default to production-ready hex codes. No further action required unless revision desired.
13,PRE-SPRINT,Pre-Sprint Admin,Admin,[PEER REVIEW BLOCKER] AHG outreach follow-up wave — non-response contacts + expand to UpS practitioner network,2026-06-15,2026-06-15,1,June 8 outreach sent,6,NO,0.5,PENDING,6 days before sprint. If no reviewer secured by June 20: begin sprint June 22 as planned but delay AHG chapter newsletter outreach until secured.
14,PRE-SPRINT,Pre-Sprint Photography,Photography,Dried herb studio session: mortar/pestle staging / glass jars / flat-lay by bundle theme — north-facing window 9am-2pm,2026-06-17,2026-06-21,5,Mountain Rose Herbs delivered,1,NO,3,PENDING,Bundle backgrounds: linen (WH) / white+elderberry (Resp) / dark wood (Imm) / grey muslin (Sleep) / kraft paper (Dgt). 100-150 raw images; cull to 50-60 keepers.
15,PRE-SPRINT,Pre-Sprint Photography,Photography,Photo editing: cull to 50-60 keepers; warm preset (+0.2 exp / -20 highlights / +15 shadows); export 2400x2400px; create PHOTO_MANIFEST.csv,2026-06-19,2026-06-21,3,Studio session complete,1,NO,3,PENDING,Target: 8-12 studio images per bundle (40-60 total) + 3-5 hero/cover candidates per bundle (15-25 usable).
16,PRE-SPRINT,Pre-Sprint Admin,Admin,[GATE CHECK] Confirm forager cohort >20% and native plants conversion >1.5% — if both drop below: hold sprint start until July 1 re-check,2026-06-20,2026-06-20,1,Phase 2 analytics confirmed,2,YES,0.25,PENDING,Current: forager cohort 21.3% (+1.3 pp buffer) / native plants 2.24% (+0.74 pp buffer). Fallback B (both gates missed): hold writing sprint to July 1 gate re-check. Zero production cost to continue pre-sprint prep regardless.
17,PRE-SPRINT,Pre-Sprint Admin,Admin,[ZERO FLOAT] Attribution logging: all Wikimedia CC + iNaturalist sources for all pre-sprint images logged in WORKLOG.md,2026-06-21,2026-06-21,1,Photo editing complete,0,YES,1,PENDING,Must complete before sprint Day 1. Log format: species / source URL / CC license type / filename. Zero tolerance on unlicensed images in published guides.
18,PRE-SPRINT,Pre-Sprint Design,Design,[ZERO FLOAT] Canva brand kit: load Phase 3 Medicinal palette (6 hex codes) + pre-test one zone card export,2026-06-21,2026-06-21,1,Palette confirmed,0,YES,0.25,PENDING,15-minute action. Additive to existing brand kit — no rebuild required. Must run before June 22. Confirms hex codes render correctly in Canva output.
19,PRE-SPRINT,Pre-Sprint Admin,Admin,[PEER REVIEW BLOCKER] AHG peer reviewer written confirmation must be in hand before sprint Day 1,2026-06-21,2026-06-21,1,June 8 + June 15 outreach sent,0,YES,0,PENDING,Revenue ceiling risk if missed. Embed reviewer name in Etsy listing description for Women's Health before June 29 upload. Required text: Reviewed by [Name] RH (AHG) [specialty] for botanical nomenclature and contraindication accuracy.
20,WEEK 1,Sprint Week 1,Writing — Women's Health,D1: WH front matter + introduction + Black Cohosh (700w — identification / 150w conservation sidebar / cultivation / harvest / active constituents / contraindications),2026-06-22,2026-06-22,1,Brand kit loaded; outlines reviewed; attribution log complete,1,YES,5,PENDING,Conservation sidebar (150w) and Cherokee traditional use framing require accuracy. Tier 3 plant orders placed same day. Contraindication block mandatory per Session 1438 standards.
21,WEEK 1,Sprint Week 1,Writing — Women's Health,D2: WH Vitex complete (600w — invasive note TN/NC / berry harvest timing / dopaminergic framing / pregnancy contraindication MANDATORY) + Red Clover complete (400w — isoflavone framing / edibility note),2026-06-23,2026-06-23,1,WH Day 1 complete,1,YES,5,PENDING,Vitex invasive watch list (TN/NC) note is mandatory. Red Clover phytoestrogenic isoflavone framing per FTC quick reference. Pregnancy contraindication cannot be deferred to v1.1.
22,WEEK 1,Sprint Week 1,Design — Women's Health,WH cover design: Black Cohosh or Calendula hero / Deep Burgundy #8B3E3E / existing template — parallel to D2 writing,2026-06-23,2026-06-23,1,WH Day 1 complete; hero photo pre-staged,4,NO,1.2,PENDING,4-day float. Lowest revision risk — wide CC-licensed Black Cohosh and Calendula selection. Pre-stage 3-5 hero candidates before starting cover session.
23,WEEK 1,Sprint Week 1,Photography — Studio,Sprint studio session 1: Calendula + Red Clover seedlings (flat-lay on linen / seedling in pot / leaf close-up),2026-06-23,2026-06-23,1,Dried herbs available,2,NO,2,PENDING,Photography is secondary to writing. Compress or skip if writing behind pace. 2-hour session.
24,WEEK 1,Sprint Week 1,Writing — Women's Health,[ZERO FLOAT — PACE GATE] D3: WH Calendula (400w) + Lavender (400w — 3 cultivars: Hidcote / Munstead / Phenomenal) + preparation methods + practitioner context + WH self-edit pass,2026-06-24,2026-06-24,1,WH Day 2 complete,0,YES,5,PENDING,ZERO FLOAT. PACE SELF-TEST EOD: if WH below 2500w activate Option C immediately. WH must be complete by June 28 EOD for June 29 upload. This is the binding pace decision point.
25,WEEK 1,Sprint Week 1,Design — Respiratory,Resp cover design: Elderberry berry cluster hero / Sage Green #6B8E6F / existing template — parallel to D3 writing,2026-06-24,2026-06-24,1,WH Day 2 complete; hero photo pre-staged,4,NO,1.2,PENDING,Lowest cover revision risk — widest CC-licensed elderberry selection of any Phase 3 species. 4-day float.
26,WEEK 1,Sprint Week 1,Photography — Studio,Sprint studio session 2: Lavender + Lemon Balm + Thyme local nursery starts (full plant habit / stem close-up / dried bundle staged),2026-06-24,2026-06-24,1,Local nursery starts available,3,NO,3,PENDING,3-day float. Secondary to writing. Session compressible to 1.5 hours if writing behind pace.
27,WEEK 1,Sprint Week 1,Writing — Respiratory,D4: Resp front matter + introduction + Elderberry (800w — raw berry toxicity / sambunigrin note / elderflower forager crossover / cultivar guide),2026-06-25,2026-06-25,1,WH writing in progress,1,YES,5,PENDING,Elderberry is the most complex Respiratory species. Raw berry toxicity and sambunigrin framing require accuracy. Elderflower culinary section is the forager cohort crossover hook.
28,WEEK 1,Sprint Week 1,Photography — Studio,Sprint studio session 3: Dried herb Immunity bundle props (mortar-and-pestle / glass jars / Immunity flat-lay),2026-06-25,2026-06-25,1,Dried herbs delivered,1,NO,3,PENDING,Parallel to Resp Day 1 writing. Photography secondary — writing has priority on any constrained day.
29,WEEK 1,Sprint Week 1,Writing — Respiratory,D5: Resp Mullein (600w — biennial lifecycle / first-year rosette vs. second-year spike / ear oil preparation) + Echinacea two-species (600w — E. purpurea vs. E. angustifolia / UpS At-Risk sidebar MANDATORY),2026-06-26,2026-06-26,1,Resp Day 1 complete,1,YES,5,PENDING,E. angustifolia conservation sidebar mandatory. Two-species comparison is primary content differentiation vs. PLR competitors. UpS At-Risk framing required.
30,WEEK 1,Sprint Week 1,Photography — Admin,Sprint studio session 4: edit + cull Days 1-3 photos; rate keepers; export 2400x2400px for Canva import,2026-06-26,2026-06-26,1,Studio sessions 1-3 complete,2,NO,2,PENDING,Cull to 8-12 keepers per bundle. Secondary to writing. Can compress to 1 hour of culling only if writing behind pace.
31,WEEK 1,Sprint Week 1,Writing — Respiratory,D6: Resp Thyme (500w — thymol framing / pregnancy caution at high doses) + shared sections + WH final self-edit pass,2026-06-27,2026-06-27,1,Resp Day 2 complete,2,NO,4,PENDING,Lighter day. WH self-edit is final quality gate before PDF export. Resp can slip 1 day without affecting July 6-7 upload date.
32,WEEK 1,Sprint Week 1,Writing — Respiratory + Admin,D7: Resp self-edit pass + WH PDF export QA (5MB limit check / no placeholder text / attribution confirm / thumbnail crop test at 170x135px),2026-06-28,2026-06-28,1,Resp writing complete; WH self-edit done,2,NO,2,PENDING,WH PDF must be export-ready by EOD Day 7. Resp PDF targeted complete; can slip 1 day to June 29 without upload impact. Verify all contraindication blocks present before export.
33,WEEK 1,Sprint Week 1,Checkpoint,[CHECKPOINT 1] Green: WH writing complete (3800w) and export-ready / Resp writing complete (3600w) / June 29 upload ready / 2 of 5 Canva covers done,2026-06-28,2026-06-28,0,Day 7 complete,0,YES,0,TARGET,If WH not export-ready by June 28 EOD: upload shifts to June 30 (2-day slip / zero cascade). If Resp not complete: Resp shifts to July 8 upload / Sleep shifts to July 15.
34,WEEK 2,Sprint Week 2,Upload — Women's Health,[MILESTONE 1] Women's Health uploaded to Etsy (9-10am ET) — REVENUE STARTS — 72-hr algorithmic discovery window opens,2026-06-29,2026-06-29,1,WH PDF complete; all 5 image slots filled; 13 tags verified; peer review quote embedded in listing,0,YES,2,PENDING,Upload checklist: title <140 chars / 13 tags each <20 chars / 5 image slots / test buyer download / practitioner 10-pack simultaneous upload ($120-150). Reviewer quote in listing description.
35,WEEK 2,Sprint Week 2,Writing — Immunity,D8: WH upload AM (2 hrs) + Imm introduction + Echinacea condensed (immunity framing — 60% of Resp length / immune modulation vs. respiratory support reframing),2026-06-29,2026-06-29,1,WH upload complete,1,YES,3,PENDING,Post-upload pivot to Immunity. Echinacea second occurrence — reframe from respiratory support to immune modulation. 600 words.
36,WEEK 2,Sprint Week 2,Design — Immunity,Immunity cover design: Goldenseal root or Ashwagandha hero / Deep Burgundy #8B3E3E / existing template,2026-06-29,2026-06-29,1,WH upload complete; hero photo pre-staged,4,NO,1.2,PENDING,Highest revision risk cover — Goldenseal root hero may require multiple sourcing attempts. Pre-stage 3-5 candidates before starting. 4-day float.
37,WEEK 2,Sprint Week 2,Writing — Immunity,D9: Imm Ashwagandha complete (900w — Rasayana context / withanolide RCT framing / cultivation zones 8-12 perennial / 5-7 annual / MANDATORY thyroid + pregnancy warning),2026-06-30,2026-06-30,1,Immunity Day 1 complete,1,YES,5,PENDING,Thyroid/pregnancy warning is mandatory — omitting creates product liability. Ashwagandha is the longest single species section in Phase 3 at 900 words.
38,WEEK 2,Sprint Week 2,Design — Sleep,Sleep cover design: Passionflower flower hero / Muted Lavender #9B8BA0 / existing template,2026-06-30,2026-06-30,1,Immunity Day 1 complete; hero photo pre-staged,3,NO,1.2,PENDING,Passionflower iNaturalist CC-BY SE US flower image is the listing thumbnail — visually superior to most live specimens. 3-day float.
39,WEEK 2,Sprint Week 2,Writing — Immunity,D10: Imm Elderberry condensed (fermentation note / immunity framing / anthocyanin harvest timing) + Goldenseal introduction + CITES Appendix II sidebar (200w — MANDATORY in guide body),2026-07-01,2026-07-01,1,Immunity Day 2 complete,1,YES,5,PENDING,CITES sidebar is mandatory per Session 1438 standards. Verbatim text required — see Appendix A of critical path document. Cannot be deferred to v1.1.
40,WEEK 2,Sprint Week 2,Design — Women's Health,WH zone card: existing Phase 2 template / 4-field fill (bundle name / primary species / cultivation zone range / harvest timing),2026-07-01,2026-07-01,1,WH cover done,4,NO,0.8,PENDING,4-day float. 4-field template fill from existing Phase 2 zone card. No structural redesign needed.
41,WEEK 2,Sprint Week 2,Writing — Immunity,D11: Imm Goldenseal cultivation (200w — forest farming / rhizome propagation) + FGV sourcing documentation + berberine active constituents + all shared sections + self-edit,2026-07-02,2026-07-02,1,Immunity Day 3 complete,1,YES,5,PENDING,FGV sourcing: cite UpS FGV participant directory at unitedplantsavers.org/forest-grown-verified. Berberine framing: contains berberine an alkaloid studied in vitro and clinical settings for antimicrobial activity.
42,WEEK 2,Sprint Week 2,Design — Respiratory,Resp zone card: existing template / 4-field fill,2026-07-02,2026-07-02,1,Resp cover done,4,NO,0.8,PENDING,4-day float. Elderberry berry cluster thumbnail visible in zone card header.
43,WEEK 2,Sprint Week 2,Writing — Sleep,D12: Sleep front matter + introduction + Valerian complete (800w — second-year root harvest / valerenic acid framing / MANDATORY sedative drug interaction warning with CNS depressants + benzodiazepines),2026-07-03,2026-07-03,1,Immunity writing in progress,1,YES,4,PENDING,Sedative drug interaction warning is mandatory. Second-year root harvest detail is primary differentiation for practitioner buyers.
44,WEEK 2,Sprint Week 2,Design — Digestive,[DESIGN LOCK EOD] Digestive cover: Dandelion root or Ginger rhizome hero / Sage Green #6B8E6F / existing template — FINAL COVER IN PRODUCTION,2026-07-03,2026-07-03,1,Hero photo pre-staged,0,YES,1.2,PENDING,DESIGN LOCK EOD July 3. Zero float. No design changes after this date until post-launch. Any cover change after July 3 requires 1.2 hrs rework minimum.
45,WEEK 2,Sprint Week 2,Checkpoint,[CHECKPOINT 2] Green: WH live on Etsy / Immunity complete (3800w) / Sleep writing started / all 5 Canva covers in production / design lock confirmed,2026-07-03,2026-07-03,0,Day 12 complete,0,YES,0,TARGET,If Immunity not complete by July 3: Immunity shifts July 20 to July 27 (zero sprint-close impact). If Sleep not started: Sleep shifts July 13 to July 16 (3-day slip / no cascade on practitioner tier).
46,WEEK 2,Sprint Week 2,Writing — Sleep,D13: Sleep Passionflower complete (700w — maypop forager crossover / trellis requirements / chrysin+vitexin framing / MANDATORY MAOI interaction note),2026-07-04,2026-07-04,1,Sleep Day 1 complete,2,NO,4,PENDING,MAOI interaction note is mandatory. Passionflower maypop fruit is the forager cohort crossover hook connecting to Phase 2 content.
47,WEEK 2,Sprint Week 2,Writing — Sleep,D14: Sleep Lemon Balm condensed (nervine framing / MANDATORY TSH caution with thyroid conditions) + Lavender condensed (linalool / aromatherapy / sleep sachet — distinct from WH salve framing) + shared sections + self-edit,2026-07-05,2026-07-05,1,Sleep Day 2 complete,2,NO,4,PENDING,Lemon Balm TSH warning mandatory. Lavender second occurrence must reframe from WH topical/salve angle to Sleep aromatherapy/sachet angle. Shared species efficiency: 40% effort of first-occurrence.
48,WEEK 2,Sprint Week 2,Checkpoint,[CHECKPOINT 3] Green: Immunity complete (3800w) / Sleep complete (3500w) / all 5 covers complete / design lock active / Resp PDF queued for July 6-7 upload,2026-07-05,2026-07-05,0,Day 14 complete,0,YES,0,TARGET,If Sleep not complete July 5: Sleep upload shifts July 13 to July 16 (3-day slip / practitioner tier shifts to July 18). Revenue impact negligible.
49,WEEK 3,Sprint Week 3,Upload — Respiratory,[MILESTONE 2] Respiratory uploaded to Etsy (9-10am ET) — REVENUE STARTS — 7-day spacing from WH maximizes algorithmic separation,2026-07-06,2026-07-06,1,Resp PDF complete; all 5 image slots filled; 13 tags verified,1,YES,2,PENDING,72-hr Etsy discovery window. Cold/flu research intent builds July-August. Upload checklist: title / tags / 5 image slots / test download / practitioner 10-pack simultaneous.
50,WEEK 3,Sprint Week 3,Writing — Digestive,D15: Resp upload AM (2 hrs) + Digestive introduction + Dandelion complete (900w — bitters preparation / wild-edibles cross-sell hook / roasted root coffee substitute / inulin/taraxacin framing),2026-07-06,2026-07-06,1,Resp upload complete,1,YES,5,PENDING,HIGHEST-LEVERAGE SECTION IN PHASE 3. Dandelion cross-sell hook connects wild-edibles forager cohort to medicinal herbs. Kit FORAGER20 segment trigger activates August 3 on this content.
51,WEEK 3,Sprint Week 3,Design — Immunity + Digestive,Immunity zone card + Digestive zone card: existing template / 4-field fill each (0.8 hr per card),2026-07-06,2026-07-07,2,Immunity and Digestive covers done,2,NO,1.6,PENDING,2-day float. Parallel to Digestive writing — design secondary on constrained days.
52,WEEK 3,Sprint Week 3,Writing — Digestive,D16: Digestive Calendula condensed (digestive framing — internal infusion / mucosal healing / NOT topical salve angle) + Lemon Balm condensed (carminative framing / post-meal gas relief) + shared sections,2026-07-07,2026-07-07,1,Digestive Day 1 complete,1,NO,4,PENDING,Calendula digestive framing must be distinct from WH topical salve angle — internal infusion and GI use is the differentiation. Lemon Balm second occurrence: carminative/digestive foreground vs. nervine foreground.
53,WEEK 3,Sprint Week 3,Design — Sleep,Sleep zone card: existing template / 4-field fill,2026-07-07,2026-07-07,1,Sleep cover done,2,NO,0.8,PENDING,2-day float. Passionflower flower thumbnail visible in zone card header.
54,WEEK 3,Sprint Week 3,Design — All,Template consistency review + export test all 5 covers: thumbnail crop 170x135px / no placeholder text / attribution present in all image slots,2026-07-07,2026-07-07,1,All covers done; design lock active,2,NO,0.5,PENDING,Verify Etsy preview crop 170x135px for all 5 covers. Confirm hex codes match brand kit. Playfair Display Bold headers / Lato Italic for Latin binomials.
55,WEEK 3,Sprint Week 3,Checkpoint,[CHECKPOINT 4] Green: Resp live / Immunity complete / Sleep complete / Digestive at 1500+ words / all 5 covers done / design lock confirmed,2026-07-07,2026-07-07,0,Day 16 complete,0,YES,0,TARGET,If Digestive below 1500w July 7: Aug 3 upload shifts to Aug 10 (zero sprint-close impact). If Sleep not complete: Sleep upload shifts July 13 to July 16.
56,WEEK 3,Sprint Week 3,Writing — Digestive,D17: Digestive Ginger complete (700w — cultivation zones 8-12 perennial / 5-7 annual container / grocery store rhizome warning / gingerol+shogaol framing / nausea RCT evidence base) + Digestive self-edit,2026-07-08,2026-07-08,1,Digestive Day 2 complete,2,NO,4,PENDING,Ginger nausea RCT evidence is the strongest of any Phase 3 species. Grocery store rhizome warning: often treated — use untreated rhizomes from Strictly Medicinal Seeds or tropical plant supplier.
57,WEEK 3,Sprint Week 3,Review — All Bundles,D18: FTC language compliance review all 5 bundles — priority order: WH (Black Cohosh / Vitex) → Immunity (Goldenseal CITES / Ashwagandha thyroid+pregnancy) → Sleep (sedative interactions) → Resp → Digestive,2026-07-09,2026-07-09,1,All writing complete,2,NO,3,PENDING,Use FTC Quick Reference table in critical path Appendix A. Cannot defer Women's Health and Immunity FTC pass — highest liability exposure. Digestive and Resp can defer to post-launch v1.1 if Float Day 1 consumed.
58,WEEK 3,Sprint Week 3,SEO + PDF Export,D19: SEO optimization pass (Etsy title/tag keyword density verification) + PDF export all 5 bundles (5MB limit / no placeholder text / all images attributed in sources section),2026-07-10,2026-07-10,1,FTC review complete,1,NO,2,PENDING,Etsy title: primary keyword in first 40 chars / under 140 total chars. 13 tags each under 20 chars. PDF under 5MB per bundle. Confirm all contraindication blocks present in every bundle.
59,WEEK 3,Sprint Week 3,Admin — Upload Prep,D20: File naming convention for all 5 bundles + practitioner variant staging (add license page) + Etsy listing QA for Sleep + Immunity + Digestive queued bundles,2026-07-11,2026-07-11,1,PDFs exported,1,NO,2,PENDING,Practitioner 10-pack price $120-150. Practitioners are highest-LTV segment across all 5 bundles. License page text required per phase-3-medicinal-herbs-etsy-listings.md.
60,WEEK 3,Sprint Week 3,Float,FLOAT DAY 1: absorbs writing overrun from any Week 3 day OR use for Sleep upload staging and practitioner variant QA,2026-07-12,2026-07-12,1,Writing complete,0,NO,0-8,FLOAT,8 hours available. If Days 15-20 on schedule: use for Sleep upload staging / practitioner variant QA / WORKLOG.md update.
61,WEEK 3,Sprint Week 3,Upload — Sleep,[MILESTONE 3] Sleep uploaded to Etsy (9-10am ET) — REVENUE STARTS — 7-day spacing from Resp — SPRINT COMPLETION,2026-07-13,2026-07-13,1,Sleep PDF complete; all 5 image slots filled; 13 tags verified,0,YES,2,PENDING,SPRINT COMPLETION DEFINITION: WH + Resp + Sleep live. Immunity and Digestive staged for July 20 and August 3. Sprint retrospective + WORKLOG.md final update.
62,WEEK 3,Sprint Week 3,Admin — Practitioner Tier,[MILESTONE 3B] Practitioner tier live: upload practitioner 10-pack listings for all 3 live bundles ($120-150 each) — 3-bundle clinical library minimum met,2026-07-15,2026-07-15,1,WH + Resp + Sleep live,2,NO,1,PENDING,2-day float after Sleep upload. Practitioner tier is the highest-revenue-per-unit product in Phase 3. AHG directory cold outreach activates same day.
63,WEEK 3,Sprint Week 3,Checkpoint,[CHECKPOINT 5 — SPRINT CLOSE] Confirm: WH + Resp + Sleep live / Immunity staged July 20 / Digestive staged August 3 / all 5 PDFs export-ready / practitioner tier live July 15,2026-07-13,2026-07-13,0,Day 22 complete,0,YES,0,TARGET,Sprint NOT complete if any of 3 core bundle PDFs not ready. All 5 PDFs must be export-ready regardless of upload date. Immunity and Digestive upload dates are post-sprint by design — not a failure condition.
