Supplier,Elderberry Availability/Lead Time,Echinacea Availability/Lead Time,Lavender Availability/Lead Time,Lemon Balm Availability/Lead Time,Mullein Availability/Lead Time,Passionflower Availability/Lead Time,Valerian Availability/Lead Time,Bulk Pricing Estimate,June 21 Delivery Feasible?,Notes
NativeWildflowers.net,"IN STOCK — bareroot ships NOW; 3-5 day shipping","[NOT PRIMARY — check website]","[NOT PRIMARY]","[NOT PRIMARY]","[NOT PRIMARY]","[NOT PRIMARY]","[NOT PRIMARY]","$4.99-5.99/bareroot plant; 10 for $39.99; 25 for $89.99",YES (for bareroot herbs stocked),"NEW as of May 22. Confirmed in-stock source for Goldenseal ($4.99) and Black Cohosh ($5.99) — both ships immediately. Use for any other species confirmed on their medicinal herb page. Relationship status: retail/website order only."
Prairie Moon Nursery,"Summer availability UNCERTAIN — spring season closed; verify June 1 via website or call 866-417-8156","E. angustifolia plug likely mid-season; 3-4 weeks lead time","[NOT PRIMARY — local nursery preferred]","[NOT PRIMARY]","Seed packet available year-round $3.50; 1-2 week lead","Transplant likely available June; 3-4 weeks lead","Transplant likely available June; 3-4 weeks lead","$3.50-18/plant depending on species; no MOQ for retail","UNCERTAIN for Elderberry (summer availability unconfirmed); YES for Tier 3 herbs if ordered June 22","CONFIRMED OUT OF STOCK: Goldenseal (spring season closed — fall only Oct) and Black Cohosh (spring season closed — fall only Oct). Do not use for these two species. Call 866-417-8156 or check prairiemoon.com June 1 to confirm Elderberry summer stock. Relationship status: retail. No wholesale account needed at Phase 3 volumes."
Strictly Medicinal Seeds,"[NOT PRIMARY for Elderberry]","E. purpurea transplant $4-7; E. angustifolia seed/plug $3-6; 2-3 weeks","Seed/transplant available $4-7; 2-3 weeks","Transplant $5-8; 2-3 weeks","Seed pack $3-5; 1-2 weeks","Transplant $8-12; 3-4 weeks","Transplant $6-10; 2-3 weeks","USDA Organic on most; $3-18/unit; no retail MOQ","YES for Tier 3 herbs ordered June 22 (arrives July 6-13); NO for Goldenseal and Black Cohosh live root (fall only)","Potted Goldenseal ships mid-March through July — stock uncertain; email info@strictlymedicinalseeds.com to confirm before ordering. Black Cohosh potted ships through June — marginal; email immediately. Live roots for both species are FALL ONLY (Sep-Dec). Primary source for Echinacea, Ashwagandha, Passionflower, Valerian at Phase 3 photography volumes. Relationship status: retail email inquiry sent May 22 [FILL status]."
Mountain Rose Herbs (dried herbs),"Elderberry (dried whole) — est. $5-8/oz; verify before June 15 order","E. purpurea root est. $6-9/oz; E. angustifolia root est. $12-16/oz; verify before June 15","Lavender flower est. $5-8/oz; verify before June 15","Lemon Balm leaf est. $5-7/oz; verify before June 15","[Mullein leaf — check availability]","Passionflower herb est. $6-8/oz; verify before June 15","Valerian root est. $6-9/oz; verify before June 15","Retail ~$5-28/oz; no MOQ for retail; wholesale minimum $250-500 (not needed at Phase 3 volumes)","YES for dried herbs ordered by June 15 (3-5 day ship); NO for Goldenseal root (OUT OF STOCK) and Black Cohosh root (OUT OF STOCK)","CRITICAL CHANGE May 22: Goldenseal root ($26.50/oz) and Black Cohosh root ($20.75/4oz) both confirmed OUT OF STOCK at mountainroseherbs.com — no restock date given. Order all other 11 species dried herbs for photo prop studio session (June 17-21). Total est. $73-107 retail. Order deadline: June 15 for June 17-21 delivery. If not shipped by June 13: order Frontier Co-op same day as backup. Contact: wholesale@mountainroseherbs.com. Relationship status: retail; wholesale inquiry sent May 22 [FILL]."
Southern Exposure Seed Exchange,"[NOT PRIMARY for Elderberry at this timeline]","Seed or transplant $4-7; 2-3 weeks; [CONFIRM June availability]","Seed/transplant $4-7; 2-3 weeks; [CONFIRM]","Seed/transplant $4-6; 2-3 weeks; [CONFIRM]","[NOT PRIMARY]","[NOT PRIMARY]","Seed $4-6; 2-3 weeks; [CONFIRM]","No MOQ for retail; open-pollinated heirloom focus; $2-10/unit","UNCERTAIN — primary catalog is January-February; June availability for perennial transplants is uncertain; [CONFIRM via southernexposure.com/contact/]","Southeast/Appalachian regional alternative for guide citations. Goldenseal seed only (not rhizome — not a photo specimen source). Email inquiry target: sent May 20 [FILL status]. Use as backup citation in guides for Appalachian-region practitioners. Not a primary Phase 3 specimen supplier."
Fedco Seeds,"[NOT PRIMARY]","Echinacea seed/plug $4-6; 2-3 weeks; [CONFIRM]","Seed/plug $5-7; 2-3 weeks; [CONFIRM]","Seed/plug $4-6; 2-3 weeks; [CONFIRM]","[NOT PRIMARY]","[NOT PRIMARY]","Seed/plug $5-7; 2-3 weeks; [CONFIRM]","Worker-owned co-op; non-GMO open-pollinated; no retail MOQ; $2-18/unit","UNCERTAIN — spring plant stock may be depleted by late May; [CONFIRM via fedcoseeds.com/contact]","Northeast US regional alternative — important citation for practitioners in VT, ME, NH, NY. Conservation species (Black Cohosh, Echinacea angustifolia) sell out rapidly — do not plan on Fedco without confirming inventory. January-February is their primary order season. Contact via form at fedcoseeds.com/contact. Relationship status: retail; email inquiry sent May 20 [FILL]."
Local nursery (generic),"2-gallon potted Elderberry shrub — MOST RELIABLE June source; 1-2 week lead","[NOT PRIMARY]","Lavender potted starts — available at most garden centers spring through July; same-week purchase","Lemon Balm potted starts — widely available; same-week purchase","[NOT PRIMARY]","[NOT PRIMARY]","[NOT PRIMARY]","$8-35/plant depending on species; no MOQ","YES — most reliable path for Elderberry and for culinary herbs (Lavender, Lemon Balm) for the June 17-21 studio session","BACKUP for Elderberry if Prairie Moon cannot confirm summer stock. Call local garden centers, nurseries, or farm stores June 1-5. Whole Foods, Fresh Market, or local herb co-ops often stock dried Mountain Rose Herbs products locally even when MRH online ordering is out of stock — use for Goldenseal root and Black Cohosh root dried props if needed. No advance ordering needed — visit in person."
